{
  "$schema": "https://json-schema.org/draft/2020-12/schema",
  "$id": "https://raw.githubusercontent.com/liqiongyu/my-agents/main/schemas/catalog.schema.json",
  "title": "Skills, Agents, Hooks & Packs Catalog",
  "type": "object",
  "additionalProperties": false,
  "required": ["schemaVersion", "generatedAt", "skills", "agents", "hooks", "packs"],
  "properties": {
    "schemaVersion": {
      "type": "integer",
      "const": 1
    },
    "generatedAt": {
      "type": "string",
      "format": "date-time",
      "description": "ISO 8601 timestamp of when the catalog was generated."
    },
    "skills": {
      "type": "array",
      "items": {
        "type": "object",
        "additionalProperties": false,
        "required": [
          "name",
          "path",
          "displayName",
          "description",
          "version",
          "maturity",
          "categories"
        ],
        "properties": {
          "name": {
            "type": "string",
            "pattern": "^[a-z0-9]+(?:-[a-z0-9]+)*$"
          },
          "path": {
            "type": "string",
            "pattern": "^skills\\/[a-z0-9]+(?:-[a-z0-9]+)*$"
          },
          "displayName": {
            "type": "string",
            "minLength": 1
          },
          "description": {
            "type": "string",
            "minLength": 1
          },
          "version": {
            "type": "string",
            "pattern": "^\\d+\\.\\d+\\.\\d+(?:-[0-9A-Za-z.-]+)?(?:\\+[0-9A-Za-z.-]+)?$"
          },
          "maturity": {
            "type": "string",
            "enum": ["experimental", "beta", "stable", "deprecated"]
          },
          "categories": {
            "type": "array",
            "minItems": 1,
            "items": {
              "type": "string",
              "pattern": "^[a-z0-9]+(?:-[a-z0-9]+)*$"
            }
          },
          "tags": {
            "type": "array",
            "items": {
              "type": "string"
            }
          }
        }
      }
    },
    "agents": {
      "type": "array",
      "items": {
        "type": "object",
        "additionalProperties": false,
        "required": [
          "name",
          "path",
          "displayName",
          "description",
          "version",
          "maturity",
          "categories",
          "archetype"
        ],
        "properties": {
          "name": {
            "type": "string",
            "pattern": "^[a-z0-9]+(?:-[a-z0-9]+)*$"
          },
          "path": {
            "type": "string",
            "pattern": "^agents\\/[a-z0-9]+(?:-[a-z0-9]+)*$"
          },
          "displayName": {
            "type": "string",
            "minLength": 1
          },
          "description": {
            "type": "string",
            "minLength": 1
          },
          "version": {
            "type": "string",
            "pattern": "^\\d+\\.\\d+\\.\\d+(?:-[0-9A-Za-z.-]+)?(?:\\+[0-9A-Za-z.-]+)?$"
          },
          "maturity": {
            "type": "string",
            "enum": ["experimental", "beta", "stable", "deprecated"]
          },
          "categories": {
            "type": "array",
            "minItems": 1,
            "items": {
              "type": "string",
              "pattern": "^[a-z0-9]+(?:-[a-z0-9]+)*$"
            }
          },
          "tags": {
            "type": "array",
            "items": {
              "type": "string"
            }
          },
          "archetype": {
            "type": "string",
            "enum": ["explorer", "reviewer", "implementer", "planner", "debugger", "custom"]
          },
          "skills": {
            "type": "array",
            "items": {
              "type": "string",
              "pattern": "^[a-z0-9]+(?:-[a-z0-9]+)*$"
            }
          },
          "agents": {
            "type": "array",
            "items": {
              "type": "string",
              "pattern": "^[a-z0-9]+(?:-[a-z0-9]+)*$"
            }
          },
          "platforms": {
            "type": "array",
            "items": {
              "type": "string"
            }
          }
        }
      }
    },
    "hooks": {
      "type": "array",
      "items": {
        "type": "object",
        "additionalProperties": false,
        "required": [
          "name",
          "path",
          "displayName",
          "description",
          "version",
          "maturity",
          "categories",
          "events"
        ],
        "properties": {
          "name": {
            "type": "string",
            "pattern": "^[a-z0-9]+(?:-[a-z0-9]+)*$"
          },
          "path": {
            "type": "string",
            "pattern": "^hooks\\/[a-z0-9]+(?:-[a-z0-9]+)*$"
          },
          "displayName": {
            "type": "string",
            "minLength": 1
          },
          "description": {
            "type": "string",
            "minLength": 1
          },
          "version": {
            "type": "string",
            "pattern": "^\\d+\\.\\d+\\.\\d+(?:-[0-9A-Za-z.-]+)?(?:\\+[0-9A-Za-z.-]+)?$"
          },
          "maturity": {
            "type": "string",
            "enum": ["experimental", "beta", "stable", "deprecated"]
          },
          "categories": {
            "type": "array",
            "minItems": 1,
            "items": {
              "type": "string",
              "pattern": "^[a-z0-9]+(?:-[a-z0-9]+)*$"
            }
          },
          "tags": {
            "type": "array",
            "items": {
              "type": "string"
            }
          },
          "events": {
            "type": "array",
            "minItems": 1,
            "items": {
              "type": "string"
            }
          },
          "platforms": {
            "type": "array",
            "items": {
              "type": "string"
            }
          }
        }
      }
    },
    "packs": {
      "type": "array",
      "items": {
        "type": "object",
        "additionalProperties": false,
        "required": [
          "name",
          "path",
          "displayName",
          "description",
          "version",
          "maturity",
          "packType",
          "categories"
        ],
        "properties": {
          "name": {
            "type": "string",
            "pattern": "^[a-z0-9]+(?:-[a-z0-9]+)*$"
          },
          "path": {
            "type": "string",
            "pattern": "^packs\\/[a-z0-9]+(?:-[a-z0-9]+)*$"
          },
          "displayName": {
            "type": "string",
            "minLength": 1
          },
          "description": {
            "type": "string",
            "minLength": 1
          },
          "version": {
            "type": "string",
            "pattern": "^\\d+\\.\\d+\\.\\d+(?:-[0-9A-Za-z.-]+)?(?:\\+[0-9A-Za-z.-]+)?$"
          },
          "maturity": {
            "type": "string",
            "enum": ["experimental", "beta", "stable", "deprecated"]
          },
          "packType": {
            "type": "string",
            "enum": ["role-pack", "agent-team"]
          },
          "persona": {
            "type": "string",
            "pattern": "^[a-z0-9]+(?:-[a-z0-9]+)*$"
          },
          "categories": {
            "type": "array",
            "minItems": 1,
            "items": {
              "type": "string",
              "pattern": "^[a-z0-9]+(?:-[a-z0-9]+)*$"
            }
          },
          "tags": {
            "type": "array",
            "items": {
              "type": "string"
            }
          },
          "skills": {
            "type": "array",
            "items": {
              "type": "string",
              "pattern": "^[a-z0-9]+(?:-[a-z0-9]+)*$"
            }
          },
          "agents": {
            "type": "array",
            "items": {
              "type": "string",
              "pattern": "^[a-z0-9]+(?:-[a-z0-9]+)*$"
            }
          },
          "hooks": {
            "type": "array",
            "items": {
              "type": "string",
              "pattern": "^[a-z0-9]+(?:-[a-z0-9]+)*$"
            }
          },
          "leadAgent": {
            "type": "string",
            "pattern": "^[a-z0-9]+(?:-[a-z0-9]+)*$"
          }
        }
      }
    }
  }
}
