{
  "schemaVersion": 1,
  "skills": [
    {
      "name": "agent-architect",
      "path": "skills/agent-architect",
      "displayName": "Agent Architect",
      "description": "Analyze a coding project and design a tailored AI development environment: recommend agents, skills, instruction files, MCP servers, and workflow composition across Claude Code and Codex. Also audit an existing AI setup for gaps, overlap, or bloat. Use when setting up, overhauling, or auditing a project's AI tooling as a whole, not for individual agent edits or skill management.",
      "version": "0.1.1",
      "maturity": "experimental",
      "categories": [
        "workflow",
        "design",
        "productivity"
      ],
      "tags": [
        "agent-architect",
        "ai-environment",
        "project-analysis",
        "agent-design",
        "dual-platform"
      ]
    },
    {
      "name": "agent-lifecycle-manager",
      "path": "skills/agent-lifecycle-manager",
      "displayName": "Agent Lifecycle Manager",
      "description": "Manage the lifecycle of sub-agents: create or update agent packages, validate cross-surface agent contracts, evaluate routing behavior, tighten invocation boundaries, tune Codex runtime defaults, install or publish agents, or audit an agent library. Use only when the request is explicitly about agents or agent libraries, not for ordinary coding, implementation, or general project planning.",
      "version": "0.6.0",
      "maturity": "experimental",
      "categories": [
        "workflow",
        "design",
        "productivity"
      ],
      "tags": [
        "agent-lifecycle",
        "subagents",
        "agent-authoring",
        "agent-validation",
        "agent-audit",
        "codex-runtime-controls"
      ]
    },
    {
      "name": "agentic-development",
      "path": "skills/agentic-development",
      "displayName": "Agentic Development",
      "description": "Manual-first workflow for designing, building, evaluating, and upgrading real agentic systems. Use when the job involves tool-using agents, agent orchestration, agent runtimes or platforms, multi-agent systems, framework selection, evals, or guardrails; do not use for prompt-only work or ordinary implementation planning.",
      "version": "0.2.2",
      "maturity": "experimental",
      "categories": [
        "ai",
        "workflow",
        "design"
      ],
      "tags": [
        "agentic-development",
        "agent-engineering",
        "agent-architecture",
        "multi-agent",
        "tool-use",
        "memory",
        "guardrails",
        "evals",
        "framework-selection",
        "mcp"
      ]
    },
    {
      "name": "architecture-design",
      "path": "skills/architecture-design",
      "displayName": "Architecture Design",
      "description": "Design a new project's architecture — module decomposition, seams, and directory structure — or audit an existing one for refactoring recommendations, recording load-bearing decisions as ADRs.",
      "version": "0.2.0",
      "maturity": "experimental",
      "categories": [
        "design",
        "coding"
      ],
      "tags": [
        "architecture",
        "adr",
        "module-decomposition",
        "user-invoked"
      ]
    },
    {
      "name": "ask-danker",
      "path": "skills/ask-danker",
      "displayName": "Ask Danker",
      "description": "本仓库 skills 的路由器——按你当前的处境指路：该用哪个 skill、走哪条流、下一步交给谁。手动调用（/ask-danker），模型不会自动触发。",
      "version": "0.9.0",
      "maturity": "experimental",
      "categories": [
        "productivity",
        "workflow"
      ],
      "tags": [
        "router",
        "navigation",
        "skill-map",
        "flows",
        "user-invoked"
      ]
    },
    {
      "name": "blind-spot-pass",
      "path": "skills/blind-spot-pass",
      "displayName": "Blind Spot Pass",
      "description": "开工前对陌生区域做一次盲区侦察：从代码库考古（git 历史、相似实现、隐形约定、危险区、邻接面） 挖出你没意识到要问的 unknown unknowns，产出带证据的盲区清单、改写后的更好 prompt 和 reference 清单。 触发词：\"blind spot pass\"、\"盲区扫描\"、\"找盲区\"、\"我还有哪些 unknown unknowns\"、 \"这块有什么我不知道的坑\"，或长任务即将进入不熟悉的模块/子系统、动手前想先摊开问题空间。 不用于压测已有计划（grill-me）、需求澄清（clarify）或仓库健康度审计（repo-entropy-audit）。",
      "version": "0.1.2",
      "maturity": "experimental",
      "categories": [
        "workflow",
        "research"
      ],
      "tags": [
        "unknown-unknowns",
        "blind-spot",
        "reconnaissance",
        "codebase-archaeology",
        "pre-implementation",
        "prompt-improvement"
      ]
    },
    {
      "name": "brainstorming",
      "path": "skills/brainstorming",
      "displayName": "Brainstorming",
      "description": "Turn ambiguous ideas or competing directions into one approved decision before planning or implementation. Invoke explicitly, or via routing from other skills when direction is still unchosen.",
      "version": "0.3.0",
      "maturity": "experimental",
      "categories": [
        "design",
        "workflow",
        "productivity"
      ],
      "tags": [
        "brainstorming",
        "design",
        "ideation",
        "decision-making",
        "requirements",
        "architecture"
      ]
    },
    {
      "name": "business-plan",
      "path": "skills/business-plan",
      "displayName": "Business Plan",
      "description": "Use this skill for substantial business planning work: drafting or revising a business plan, investor-ready financial analysis, market sizing, pitch deck narrative, strategic review, or business valuation. It is especially useful when the user needs structured commercial thinking, investor-grade outputs, China fundraising context, or AI/agent business analysis. Prefer this skill when the main deliverable is a business analysis or plan, not open-ended idea exploration, general current-events research, or final file production in slides, docs, or spreadsheets.",
      "version": "1.1.1",
      "maturity": "stable",
      "categories": [
        "business",
        "productivity",
        "workflow"
      ],
      "tags": [
        "business-plan",
        "financial-analysis",
        "market-analysis",
        "pitch-deck",
        "valuation",
        "strategy",
        "SWOT",
        "business-model",
        "unit-economics",
        "competitive-analysis",
        "fundraising"
      ]
    },
    {
      "name": "clarify",
      "path": "skills/clarify",
      "displayName": "Clarify",
      "description": "Turn ambiguous implementation requests into actionable scope before execution. Use when asked to clarify requirements, disambiguate a request, or spec a change before building. Auto-activate only when an implementation request contains direct contradictions, is missing acceptance criteria that would materially change the build, or asks to proceed on documented assumptions. Not for direction-finding or brainstorming, nor for already-specific actionable tasks.",
      "version": "1.2.3",
      "maturity": "experimental",
      "categories": [
        "workflow",
        "productivity"
      ],
      "tags": [
        "clarification",
        "requirements",
        "ambiguity",
        "specification",
        "questioning",
        "autonomous"
      ]
    },
    {
      "name": "code-migration",
      "path": "skills/code-migration",
      "displayName": "Code Migration",
      "description": "Use for codebase-scale language ports, compatibility-preserving replacements, same-stack runtime or framework uplifts, strangler rewrites, migration feasibility, migration pilots, phased cutovers, or resuming an artifact-backed code migration. This skill owns migration classification, domain artifacts, phase gates, and handoffs. It delegates durable execution to Missions and executable oracle qualification and acceptance to VDD. Do not use for a local file conversion, routine refactor, data/schema-only migration, or a small incremental language adoption that fits ordinary TDD/VDD.",
      "version": "0.1.0",
      "maturity": "experimental",
      "categories": [
        "coding",
        "refactoring"
      ],
      "tags": [
        "migration",
        "port",
        "equivalence",
        "cutover",
        "user-invoked"
      ]
    },
    {
      "name": "codeagent",
      "path": "skills/codeagent",
      "displayName": "Codeagent",
      "description": "Execute codeagent-wrapper for multi-backend AI code tasks. Supports Codex, Claude, Gemini, OpenCode, and OMP (oh-my-pi) backends with agent presets, skill injection, worktree isolation, parallel task orchestration, and structured JSON output.",
      "version": "0.2.3",
      "maturity": "experimental",
      "categories": [
        "coding",
        "workflow",
        "ai"
      ],
      "tags": [
        "codeagent-wrapper",
        "codex",
        "claude",
        "gemini",
        "opencode",
        "omp",
        "parallel"
      ]
    },
    {
      "name": "deep-research",
      "path": "skills/deep-research",
      "displayName": "Deep Research",
      "description": "Use when the user explicitly asks for comprehensive, citation-backed research such as a deep dive, due diligence, market analysis, or a multi-source comparison/report. Do not activate for quick factual lookups, ordinary coding tasks, or routine content generation unless the user first asks for research or source verification.",
      "version": "0.4.2",
      "maturity": "experimental",
      "categories": [
        "research",
        "productivity"
      ],
      "tags": [
        "research",
        "analysis",
        "web-search",
        "citations",
        "report"
      ]
    },
    {
      "name": "diagnosing-bugs",
      "path": "skills/diagnosing-bugs",
      "displayName": "Diagnosing Bugs",
      "description": "因未知失败的诊断纪律：先建红色反馈回路，后假设。适用于难缠 bug 与性能回归—— 症状明确但原因不明、修了又复发、CI 挂但本地复现不了。核心闸门：没有一条已跑过、 能红的命令，禁止读代码编理论。难缠 bug 可选多代理扇出模式（回路构建与假设生成并行化）。 触发词：\"diagnose\"、\"debug\"、\"诊断这个 bug\"、\"为什么一直挂\"、\"复现不了\"、 \"性能回归\"、\"查根因\"。不用于原因已确诊只差动手的修复（直接修）， 或\"该做什么/怎么设计\"的问题（用 grill/prototype 类）。",